cAGR,cCON,cEXT,cOPN,cNEU,text,Filename,Segment,WC,WPS,Sixltr,Dic,funct,pronoun,ppron,i,we,you,shehe,they,ipron,article,verb,auxverb,past,present,future,adverb,preps,conj,negate,quant,number,swear,social,family,friend,humans,affect,posemo,negemo,anx,anger,sad,cogmech,insight,cause,discrep,tentat,certain,inhib,incl,excl,percept,see,hear,feel,bio,body,health,sexual,ingest,relativ,motion,space,time,work,achieve,leisure,home,money,relig,death,assent,nonfl,filler,AllPunc,Period,Comma,Colon,SemiC,QMark,Exclam,Dash,Quote,Apostro,Parenth,OtherP,essay_length,personality_type,has_story,has_lexicon
1,1,0,0,0,"I feel that I am not very satisfied with school right now. I don't have that many friends but I am sure that I'll start making some soon. I miss my home and my miss my family and I miss my girlfriend who is also in fort worth. I always talk to her and I wish she was here all the time. I miss her a lot and all I can think about is being able to talk to her. school seems a little hard. I haven't gotten used to the studying habits yet. I know that I will soon get back into the grove though. I can't wait until I get to go home this weekend. I want to go home every weekend but I know I can't. it is so hot out side and I want things to cool down just a little bit. I want to be able to go out and play but I don't like going to parties and that's all people want to go do. so it seems like there isn't ever anything to do down here unless you go to a party. all I want to do is go home. it is a lot more fun at home. I don't understand why people say college is so fun when I haven't really had any fun yet. I don't want to join any frats because I don't think they're worth it. and I also hear that they make enemies also. and I don't want to make any enemies down here. my classes are kind of confusing. and since I don't know any body in the classes, I don't feel comfortable asking the people next to me questions. the weeks go by so slow. the only thing that I like about school so far is that I get done with school on Friday at eleven o'clock. that way I can leave for fort worth much sooner. my arms are starting to hurt and I still have just gotten started. time is going by so slow. I want to get out of my supplement housing. I don't like having a room with three other guys. and I don't like my room not having a sink or a mirror. I sort of like the big classes though. it makes class seem more fun. I am so sleepy right now. I don't know if I want to do my home work any more. I might just want to go home and take a nap. my room is so cold. we tried to get the a/c turned down but it still blows super cold air. and plus I sleep on the top bunk right by the a/c vents so it blows right on me. I always get a really cold nose in the middle of the night. and I also have a room mate with a really loud alarm. his alarm constantly goes off and he keeps hitting the snooze button. so every nine minutes it goes off again and again and again. it's so annoying. it's like just freaking wake up or turn off your alarm. I don't understand these people. and would be trying to sleep and then he walks into the room and turns on the lights which light up the whole room. and I'm trying to sleep. he has a little lamp but he doesn't use that instead. talk about no consideration. I don't like having to go down the hall to the bathroom just to brush my teeth. or going down to the bathroom just to put some lotion on my face. I want to be able to just wake up and do all that in front of a sink and a mirror that I don't have and what every body else does. I am getting tired of writing and I'm glad that the twenty minutes is almost up. I wonder if you guys are really going to be reading this thing all the way through. I wonder if you think I'm weird for saying some things that I have said. I wonder if I'm the only person that feels this way. last time I played basketball and now I am very sore. it's hard for me to walk around. I think I'm about to fall asleep on the computer. I can barely keep my eyes open. well sorry guy but my twenty minutes just about to up. bye bye and I hope y'all have a good day. ",1356,1,745,12.21,5.77,96.64,63.36,18.39,13.15,11.01,0.13,0.67,1.21,0.13,5.23,5.64,20.4,10.6,1.48,17.32,0.54,8.19,12.35,8.59,3.09,3.62,0.67,0.0,6.17,0.13,0.4,1.07,4.7,2.68,2.01,0.54,0.4,0.67,19.6,2.68,1.21,2.42,4.3,1.74,0.4,5.5,3.76,2.55,0.13,0.67,1.48,2.15,1.88,0.27,0.0,0.0,16.11,2.82,7.11,6.04,1.61,1.21,1.61,2.28,0.4,0.0,0.0,0.13,0.13,0.81,13.15,8.19,0.13,0.0,0.0,0.0,0.0,0.0,0.0,4.56,0.0,0.27,744,11000,True,False
1,1,0,0,1,"So yesterday my boyfriend from ORGNAME came down to LOCNAME to celebrate our 0 month anniversary. It was a lot of fun but I stayed up late so I'm pretty tired. I hate that feeling of no energy and I just want to sleep but I know I can't because I am so stressed out. I am still really adjusting to college life. It's is so different from high school and its not all that it's worked up to be. I really like all the freedom, along with everyone else, but I am finding out that its hard to keep up on my studying. I am only taking 00 hrs. , which is supposedly and easy load, but I feel so bogged down. I tell myself I am go into catch up on the weekend and it never happens because other things come up. I have so much I want to do but there are not enough hours in the day. But everyone says this is what a lot of college students feel like and it will take time for me to adjust. I just don't hope it will reflect in my grades. I thought I had a calculus test next Friday, but I came to find out today that it is nest Wednesday. That is really scary. Bit I took calculus my senior year in high school so I feel I know some of the stuff. Everyone studies hardcore for tests, which I am pretty nervous about. I don't really do to much homework in that class because I have so much to do in my other classes. I really hope I'm doing the right thing on this paper and that every other student doesn't type super fast so my paper looks really short and that I didn't try. Anyways, I have a problem with the nest football game which is TX vs. Rice. I didn't realize they sold the tickets so early. I guess the draw started yesterday. I want to go but I haven't really met a lot of close friends to go with. This guy friend from high school wants me to go but I really want to go with a big group of people. I have never been to a large football game. Actually the only games I have gone to have been my high school games. But my high school had like 0,000 people so it was a big school. A lot of the seniors from our school went to A&M because it's only an hour away. I don't know why they would want to go and pass up living in the city like this. I am originally from LOCNAME, which was so pretty, and LOCNAME isn't the prettiest place in the world. I forgot so sign off instant messenger and people are trying to talk to me. It is getting really annoying. Seems like that is a such a popular way to communicate with people now. I like it but some people are obsessed with it. But I guess I am obsessed with my cell phone. I don't even use any other phone. I am always on it. I think it is so funny when you walk to class and everyone is on  their cells. I feel like I have to take mine to and call someone so of course I do. Plus, walking to class gets kind of lonely. I feel like these thoughts pop in my head and I then I go in a tangent to try to type. But then my mind goes blank for a second. I never really thought I was a good writer. In fact, I thought I was horrible. My teachers never gave me feedback and I never felt comfortable sharing my papers in class. It wasn't until the end of my senior year, my English teacher told the whole class that I was one of the best writers in the class. I really thank her for that because that really boosted my confidence and I feel like I do write well. It almost makes me look forward to writing instead of procrastinating like I do everything else. My critical thinking teacher said that is the number one regret for students after their first semester. I believe him because it is so hard not to procrastinate. I try not to since it's such a bad thing, but I guess it's just human nature. ",2237,1,737,14.74,12.48,95.52,62.96,21.17,13.3,12.08,0.27,0.14,0.27,0.54,7.87,4.75,18.18,9.5,4.07,13.43,0.41,6.24,13.03,7.6,2.85,2.58,1.09,0.0,6.38,0.0,0.41,0.95,5.02,3.12,1.9,0.81,0.41,0.27,19.67,3.39,1.36,1.49,2.58,1.63,0.27,4.34,4.48,1.9,0.27,0.27,1.36,0.81,0.27,0.54,0.0,0.0,13.98,2.58,6.24,5.29,5.97,1.36,1.36,0.14,0.14,0.0,0.0,0.0,0.14,1.22,11.4,6.92,1.9,0.0,0.0,0.0,0.0,0.0,0.0,2.44,0.0,0.14,737,11001,True,False
0,1,0,0,0,"ok, go!  00 minutes, and don't stop. what do I write about?   I have laundry  in the washer. I hope it doesn't shrink. band was fun. only a couple of days till our first game!!!   I'm glad I tried out. PROPNAME and shannon are cool. they  helped me alot during summer band. I wonder what they think about me. my microphone fell off. I shouldn't have put it on before I moved up here. college! cool. freedom, school. high school band. Mr. k was nice   need to write thank you  to Mrs. PROPNAME. flags,  weird stuff. I'm confused. it is fun, but kinda gay. and I'm not!  my only way to be in band for now, so ok. submit. internet, wow. find everything, loose sleep. slept at noon today. I need to sleep more at night. our leopard print sheets are so cool. We are damn funny. PROPNAME is funnier. he is just plain wacky. he made callback today. I told him he would. ""na, man""   go ahead  and check, mike, you never know. they liked your accent. Biology video was crazy! ""today we are cooking leeches""   Earthworm PROPNAME. ivy had fun, too. she's having fun in LOCNAME. , but she misses us. I miss her too,   I like talking to her on ORGNAME. too many  people have icq, and it's messing up. my computer messes up, too. dell is cool, and their customer support is nice. makes me feel stupid. I felt pretty dumb in Calculus. missed the ques. on the review chapter!  I have already taken and aced the class. PROPNAME is cool. can't believe she's w/ gabe. man, that  stinks. I should have done something last year, but nooo, I was afraid. gotta be  more confident w/ girls. I'm not a bad guy, some girls even liked me. just gotta do something about it. Library. Mrs. PROPNAME was nice. surprised her good she thought I was snobby, everyone judges me before they meet me. ""that smart guy""  or ""the one on the announcements all the time""   ""the valedictorian""    I don't care. I'm a funny person, very nice, and very sweet and romantic.  State solo ensemble. PROPNAME, that was a fun bus ride. again, should have done something , kinda late, since  I was leaving for UT. Orange and white. some colors,   some school pride. girl in our hall. we are such losers. not even any alcohol or girls (except PROPNAME and my sister)   oh well, give it time. PROPNAME is cool she came down from ORGNAME. explorer didn't work. ORGNAME blazer. ford bronco, white ORGNAME. did he do it?  I don't know, but he was proven innocent, leave him alone. LOCNAME riots, man there is so much hate.  Princess Di. die. drunk driver, come on! everyone knows that!  paparazzi, not only their fault. PROPNAME is a total pothead and such a dork. nice when you meet him, then . PROPNAME. I miss PROPNAME,  he's funny. need to call PROPNAME. need to call my parents. mom misses me, poor dad, doesn't have anyone to talk to (except mom)  I hope I  still have friends when I get to be his age. I know he works too much. PROPNAME is online, so is ivy. I wonder what they're doing. PROPNAME at ORGNAME ORGNAME I bet he's having fun. we're actually doing homework  who would have thought. college. never had to study before. kinda weird. gotta read sophie's world  tonight. I have another  writing assignment for Prof. PROPNAME. weird class the meaning of life?!?   MONTY PYTHON!!!!  funny stuff.  I have their game. no  time to play it. I need to buy Interstate 00. LOCNAME wants to play. His stepdad died, but it was better that way. he misses us. I wish we could  come down. we will for homecoming. I hope there's no game that day. band again. PC and PROPNAME, do they even notice me?  I try hard, I guess,  and I really have fun. I've never done this before. picked up on it fast that's what they say. PROPNAME is cool. she notices I work hard. she never did it  before her first year either. I guess she know what it's like. 00 minutes passed 0 minutes ago. I wonder how much longer on the laundry. I'm hungry. what can I eat. ice cream is good. already had it today. jester express might still be open. I have to check  hey, movies are on tonight. SCREAM is on. cool. I think I'll watch it. time is up. ",337,1,747,5.66,12.99,87.15,52.74,19.95,14.86,8.17,1.47,0.54,3.48,1.2,5.09,2.28,20.88,13.39,4.42,13.79,1.47,5.09,8.3,4.02,2.41,2.14,0.94,0.27,12.72,0.67,0.13,1.47,10.58,7.36,3.21,0.4,0.67,1.07,14.99,2.81,0.54,2.14,3.48,1.2,0.13,3.21,2.68,3.08,0.8,0.27,1.74,1.34,0.4,0.27,0.13,0.67,12.99,1.74,4.02,7.23,2.81,1.61,2.01,0.13,0.8,0.0,0.27,1.47,0.13,0.0,31.19,16.47,6.16,0.0,0.0,0.67,2.01,0.0,1.34,3.75,0.54,0.27,749,01000,True,False
0,1,1,0,0,"what to write?  I am happy right now because I just got a phone call from a  frat that I am going to join. we are having a get together tomorrow and there are going to be strippers!  that should be cool. but I don't know what to wear. I always get nervous about what I should wear. I hope my girlfriend does not find out, even though I will probably tell her, and she'll probably get mad like she sometimes does. I wonder when clay is coming home?  we have to work out tonight, and I still have a lot of Persian how to do. my throat feels better today than it has all weekend. I was really sick for the last three days so I stayed home and watched the 00th anniv. of Planet of the Apes. that was a good movie. I have never seen any before and now I want to go buy the  whole set because it was so good. but I need to get my job first and save up my money for headshots, an agent, then I can buy crap like new clothes and videos and cds. I can't wait until tomorrow, it is going to be so much fun!  I hope that I feel okay. I feel better today but tomorrow I need to be totally healthy. I hope I did one of those things where I got sick at a good time so I didn't miss anything important. This writing takes forever, I have other stuff I need to do to. Oh, well, it's for science. I m bored. my eyes are drying out from looking at the computer screen. when is clay going to get back?  I also have some theater homework I need to do. I am so tired, maybe I should just forget the how and go to bed early so I feel good tomorrow. yeah then I could fail all my classes and get kicked out of LOCNAME. that would suck. I did nothing today. it was a relaxing though somewhat boring day. but I needed it because I have been sick all weekend. I have been able to start smoking again, but I really should quit sometime soon. I am tired, it's hard to focus. I guess my body has been working over time to kill this damn disease I got. I need to call laila, I miss her. maybe we could all play solarquest. my neck is stiff but I still have 00 minute to write. this takes forever. I wonder when it is due?  I heard the 00th but I am not so sure. I wonder what the other assignment is about. I hope it is not like this. ,  I have a lot to do tonight but I must be in bed by 00. I need all the sleep I can get. I am tired. this is really starting to bore me. what is the point? write down every thought you think. seems creepy. I hope who ever reads this one is laughing and enjoying themselves. some how I doubt it. this is not very funny--it would be though, if I could say it. I hope no one minds all the hundreds of mistakes I made, and if they do, who cares?  what are they going to do?  put in computer jail?  Someone I knew said that all the time. but I can not remember who. I miss PROPNAME. I wonder how she is doing at PROPNAME PROPNAME state. I also miss jena, I really hope I see her before she goes and flies off to LOCNAME. I hope her life is not hard, and I wish here and michael all the best. my ear hurts. four minutes left. I was beginning to feel trapped in time. stuck forever by this computer typing away through all eternity. I am really tired, but I am glad I got this one out of the way. just a couple of minutes left. that woman at the dinner was so weird. and what about her HUGE 0 year old?  that was scary, but so is ""Walt"" so I guess it is okay. Well time has run out and now it is time to go. that took forever. ",488,1,710,9.86,9.72,95.49,63.24,20.99,14.08,11.83,0.42,0.14,1.27,0.42,6.9,3.52,21.55,12.39,3.66,15.07,1.27,7.61,9.44,8.17,1.69,2.82,1.55,0.42,4.65,0.0,0.14,0.14,7.18,4.51,2.68,0.42,0.7,0.85,20.99,2.25,1.13,4.23,4.51,2.82,0.56,3.66,3.94,2.68,0.85,0.56,1.27,3.24,1.41,1.55,0.0,0.28,14.23,1.97,3.52,8.17,1.97,1.41,1.13,0.7,0.42,0.0,0.14,0.7,0.28,0.42,14.51,8.59,2.96,0.0,0.0,1.27,0.28,0.28,0.28,0.85,0.0,0.0,710,01100,True,False
1,1,0,1,0,"I feel overwhelmed at the size and population of the school and classes, but at the same time am overjoyed to be here. I spent a year at PROPNAME PROPNAME PROPNAME for my freshman year of college and liked it alright, but the school was not right for me, I think it had more to do with the town than the school, but anyhow I like being in LOCNAME and love being around old friends, but at this moment I feel as if I haven't gotten into the school year just yet. I haven't studied enough and that makes me feel inadequate inefficient, worthless. But I don't dwell on that thought and one of the things which bring me happiness is having my own home this year. Two friends of mine from high school have been rooming together for the last few weeks and there is a lot of freedom involved in having your own place and that brings a lot of comfort to me. Right now I feel relaxed, relieved to be through with classes today. tomorrow is another day and I feel like I have a lot of time to get all my assignments finished. Another comfort for today is getting to finish this assignment. This is the first day I have been able to get into the ORGNAME computer library and luckily I made it in before the deadline. I tried trice before but was rejected each time by some substantial reason which inhibited my using these wonderful machines. These are SO much better than the computers from SFA that I think I shall nut my pants. one other comfort is being able to write freely without impending restrictions from keeping you to a fake writing of what your thoughts are but not really because one is not able to freely express himself through outlawed writing styles, such as uncapitalized letters, lack of punctuation, all borders are allowed to be crossed and I love this freedom. I am feeling very good about myself right now I have just completed my first assignment of the year, well almost completed. I hope I have done this right and this has actually been fun. I look forward to writing on this assignment again. I have 0 more minutes to write I think just to be safe ill keep going a little longer . I am thinking about how this will be graded . I wonder if there could be some way of directly reading what I am writing in real time. and maybe he has hired hundreds of his minions to read just as we write so that they may choose while reading who is doing the right thing and who is not . I think I may stay here all day I like doing work and doing work well I am going to do all of my projects ahead of time so that I may be ahead of all my classes and pass in flying colors. I love school what else do I need to accomplish? I have to sign up for some experiments as well I'd best do that also. I am feeling so stress free right now , very relaxed. I think I have wrote enough but am not sure. so anyway I am the greatest artist on this world and will revolutionize this world in some way in my lifetime. this is my goal to change the world to revolutionize it to be known to be the best at everything to learn to be knowledgeable to be experienced? experienced, and to learn how the brain works is good to, and to learn how the world works , that's good to  I love life who ever does not appreciate life and appreciate the sun rising every morning is insane, I am wishing I had a disk right now to save this stream of coincioussness writing style I like it I am going to do it again, . goodbye I am submitting my work now in a minute three more minutes. I wonder what I will wish I had accomplished when I look back ten years from now. like I look back and wonder when did I think I would be right now ten years ago? hmmm that's ponderous man really ponderous. I am glad to be here rather than home because at home I can not get much done yet it is still such a new experience that I have other priorities ahead of school work there but just there not here and only sometimes. like if kori came over I would never do homework again. yeah. ",518,1,764,22.47,14.92,94.9,64.4,16.75,10.73,9.69,0.13,0.39,0.39,0.13,6.02,3.93,17.8,12.43,2.62,10.99,1.18,7.46,13.09,6.81,1.7,4.19,1.44,0.0,4.06,0.0,0.26,0.13,6.54,5.5,1.05,0.65,0.0,0.52,20.16,3.93,1.44,1.7,2.88,1.83,0.79,3.93,3.8,1.83,0.52,0.0,0.92,1.05,0.13,0.39,0.52,0.0,14.92,1.57,5.37,8.25,4.97,2.88,0.79,0.65,0.26,0.0,0.0,0.39,0.52,0.39,7.46,4.06,2.23,0.0,0.0,0.39,0.0,0.0,0.0,0.79,0.0,0.0,770,11010,True,False
1,1,1,0,0,"I am presently thinking that I cannot believe that I am actually going to sit here and write fo 00 minutes, that is a really really long time. Well I am also thinking that I am fivxing to go to aerobics from 0:00 to 00:00 and not only is it late but it is also going suck. But I need to get into shape. I am worried that if I don't go and excersise I am going to gain that dreaded freshman 00 which will not at all be cool. I come fram a town of 00,000 and everyone knows everyone and all their business so I am sure that if I go home whith any added pounds everyone will notice, and most likely comment. Well I just looked at the clock and I realized that I have only been typing for four minutes, and this really scares me because I do not want to get cramps in my hands. I hate to type, because I am not very good at it and on top of that I do not use very good grammar or punctuation, even after I checked and rechecked my work. So it does worry me that I will have to turn this assignment in unrevised. I cannot get itout of my head how weird I think this assignment is MY friend is now leaning over my shoulder trying to read the assignment and she is making me very nervous. i can not stand to be nervous. The girl next to me just call the little whistle on her screen which notifies her of new mail, and I was thinking that I love it when I hear that noise. Earlier before I started this assignment I checked my e-mail and I had one new message from my friend PROPNAME who goes to PROPNAME PROPNAME PROPNAME, I was so excited to hear from him he is one of my really good friends. the lady that is in charge of the computer station just made this girl show her, her id and when she asked for it she was not very nice. Which makes me think of the fact that I very strongly dislike people who are rude when they are providing a serviece to you. I mean it is like they are getting paid to do this so I do not know why a little common courtesy is so hard to come by, I am getting really bored with this assignment because I am having a hard time concentrating on typing while at the same time letting things naturally flow into my thoughts. But I guess that you are used to that, I am like also wondering why I am acting like you are actually going to read this because I know that you are not and it seems stupid to sit here and just jabber about nothing, someone else just got the e-mail alarm and once again I am reminded of my most recent message, which I was very excited about, my friend next to me is the one I go to aerobics with and she is already all dressed in her aerobics outfit ready to go. she just interrupted me again to ask me for the instructions on how to get here, I do not like to be bothered when I am in the middle of doing somthing, but I have found that it is very not to be bothered when you are living in a small space with someone, because no matter how quiet they are trying to be they never seem to be quiet enough, I know glanced at the clock again and I realize that at max I only have to type for 0 more minutes which excites me very much. My fingers are cramping and I am getting very old with this assignment I am hoping that the next assignment will not be timed but I am under the impression that with my luck that is am improbability, I feel sorry for my friend she just started the assignment and she has no idea what she has gotten herself into, I cannot wait until she is done so I can ask her what she thought about. WEll MY TIME IS UP!!! ",924,1,714,37.58,13.45,93.0,65.69,22.97,15.27,11.2,0.0,0.7,2.66,0.7,7.7,3.08,18.35,11.48,2.52,13.87,0.56,7.98,11.34,7.42,2.8,1.54,1.96,0.14,8.4,0.0,0.7,0.56,5.74,3.22,2.52,0.98,0.98,0.0,17.09,3.22,2.1,0.7,2.1,0.84,0.14,4.34,4.48,1.96,0.42,0.7,0.84,1.12,0.56,0.42,0.14,0.0,12.04,1.82,4.2,5.6,2.66,0.84,0.84,0.14,0.28,0.0,0.0,0.14,0.42,0.56,6.44,2.52,2.8,0.28,0.0,0.0,0.42,0.28,0.0,0.14,0.0,0.0,709,11100,True,False
