cAGR,cCON,cEXT,cOPN,cNEU,text,Filename,Segment,WC,WPS,Sixltr,Dic,funct,pronoun,ppron,i,we,you,shehe,they,ipron,article,verb,auxverb,past,present,future,adverb,preps,conj,negate,quant,number,swear,social,family,friend,humans,affect,posemo,negemo,anx,anger,sad,cogmech,insight,cause,discrep,tentat,certain,inhib,incl,excl,percept,see,hear,feel,bio,body,health,sexual,ingest,relativ,motion,space,time,work,achieve,leisure,home,money,relig,death,assent,nonfl,filler,AllPunc,Period,Comma,Colon,SemiC,QMark,Exclam,Dash,Quote,Apostro,Parenth,OtherP,essay_length,personality_type,has_story,has_lexicon
1,1,1,1,0,"Well, today was a bad day. Not bad in the sense that negative things happened, it just wasn't good. I talked to PROPNAME, the girl I really like, and it turns out she doesn't feel the same way. Earlier in the week (I hope PROPNAME isn't reading this) I had another girl come out and tell me she had feelings for me. I hope PROPNAME doesn't view me as I view the girl. She is nice, but I feel awkward. I don't know how to act or respond sometimes. Am I sending the wrong signal? Am I communicating poorly? Who knows? Certainly not me. So, that's that. PROPNAME Still really likes me as a friend, but nothing more. Kind of sucks. I wish I were more attractive. I think I got the bases covered on personality, just the physical appeal that is holding me back. I'm working at it. I am enrolled in intermediate racquetball and playing whenever I can. I'm up to two pullups. This is a big accomplishment. This summer, I started working out with my best Friend PROPNAME and then I could do any. Now two. I so excited. PROPNAME goes to ORGNAME. He was supposed to come here, with me, but decided that ""pep"" and ""spirit"" was his thing. I'm cool with that I guess, I just wish I wasn't stuck with the ""potluck"". Will, my roommate is all right and all, I just wish I could open up a little more than I do. He doesn't ""get me"" like another one of my good friends would. My best friend from high school, PROPNAME PROPNAME, will be coming up this weekend. I can't wait. I miss just hanging out with the crew. I like college and all, and I'm making the transition fine, I just miss the good ole days. I am coming to terms so much better than some I know. PROPNAME, the one who came forward to me about her feelings, is having a really ruff time. Apparently, whenever she tries to talk to her mom about it they get in a fight. So instead, the just avoids confrontation all together. Not a very wise approach if you ask me; and she did, and I told her. I like meeting new people. PROPNAME apparently doesn't. It's out of her comfort zone. Actually, that's how I met PROPNAME. She's so awesome. She into anime just like me, she draws, she's tall, and she just all around cool. Sadly, she does not share this sentiment to the extent of which I put forth. She thinks I'm hilarious and a great guy to hang out with, but she just doesn't like me like that. I should go on, get over her and whatnot. I cant. I've tried. I like her way too much. I will eventually though, or that is what I've been told by the ones I open up to here besides PROPNAME. PROPNAME is a great friend. She thought that I liked her at first, but then I started opening up to her about PROPNAME and she understood. She rooms with PROPNAME, whom I met at orientation. She had a thing for me too. I don't know, when I like them, I get turned down and away, but when I just think they are cool, I get asked out. Why can't things go my? Be different, somehow? This can't be fair. I try so hard to get what I want. It never just comes to me. Like now, in engineering, I have decided that I don't like engineering, but I'm stuck there for at least the semester. I enjoy PSY000 with PROPNAME. He's a character and the subject matter interests me. I would consider psych as a major, but that is my brothers field and I'm already too into his shadow. Oh well. We will see how things turn out. They usually do. For the better, or worse. what's the difference? I don't know. Could I even tell? If I follow that principle things would turn out regardless. good, or bad. Who cares? Well, I do. The future is uncertain and that is why it's scary. Whether or not this is actually read or just run through an analyzer, it has been a good place to vent. I look forward to the next installment in this tedious tale of love, trust, faith, and social bearings. Until the next time. =) ",1449,1,734,9.29,14.44,92.64,64.58,23.02,17.03,12.13,0.14,0.14,4.09,0.54,5.99,5.04,19.62,11.17,4.09,13.49,1.09,7.77,10.63,7.63,3.27,3.13,0.68,0.14,9.67,0.27,0.82,0.68,8.58,6.54,2.04,0.54,0.41,0.41,20.16,2.59,0.95,2.32,2.86,0.95,0.41,6.13,5.18,1.63,0.54,0.0,1.09,0.27,0.0,0.14,0.14,0.0,13.22,2.59,6.27,5.45,1.23,1.5,0.68,0.27,0.14,0.27,0.0,0.68,0.41,0.82,23.57,9.67,6.68,0.0,0.14,1.09,0.0,0.0,1.09,4.36,0.41,0.14,735,11110,True,False
0,0,0,0,0,"I finally got into this thing. that took forever. I hate asking questions so it took even longer. I think people are always thinking weird things about me, which I know is bad , but I always do. the good thing is that everyone I've come in contact here has been really helpful. I really cant wait for this weekend. the weeks are so long. I haven’t made any new friends here. I have a lot friends that  came with me from high school to LOCNAME and to other schools in LOCNAME LOCNAME. I see them every weekend. I’m being really antisocial right now. the thing is that the friends I have are really close to me, and they know everything there is to know about me, and vice versa. I spent the last two years of my life with them, it may not seem like a lot but it was two very important years of my life. I feel really comfortable around them. I m not good at  meeting people so I cant imagine being at  the same level of friendship with other people especially in college where everyone just does their own thing. so I look forward to every weekend. people around me probably think I’m weird sitting here just typing continuously. I’m sure, actually I’m almost positive there are weirder people here. id really like to finish this already, but I just looked at the clock and I still have time left. I’m going home, back to LOCNAME LOCNAME next Friday. its going to be strange. I never expected to go back so soon. I was with this girl for about 0 months before I left, and it was really serious. we talked about spending the rest of our lives together. she was supposed to move here, but she had issues and commitments that were obviously more important. She cane to visit last month for about 0 weeks before school started. we got in  a big fight and she left on really bad terms. it was my fault, but I couldn’t have her leave on good terms or it would have hurt more. so I acted like a jerk and we fought the last week and a half she was here constantly. Anyway I’m really afraid of running into her, because ill be there for a whole weekend and we hang out a t the same places. I think its really funny how a lot of people here think LOCNAME LOCNAME is so small. its as big as LOCNAME, and no one knows it. ki heard someone say that they though it only had one high school. it actually has 00-00. oh well it rally doesn’t matter, I’m glad I’m here now. I really like it,  I cant believe I’m in college and actually grown up and that I actually have real responsibilities. but I very lonely. I miss her so much, and she wants to try the whole long distance relationship thing, but I cant. I really loved her. I've never been so close to anybody in my life, and after everything we shared and as close as we were, it seems like ill never experience that again with anybody. and if I do finally find someone and then we break up I have to go through this whole pain thing again. I know its normal to feel like this, I just moved away from a city I've lived in for 00 years and I just broke up with someone I was prepared to spend the rest of my life with, but its all a little overwhelming. the thing that bothers me the most is that all this takes up too many of my thoughts, and it takes away from what I really should be concentrating on. I really want  to do well here at LOCNAME, I have a lot to prove to a lot of people. I’m sick of always having this sob story attached to my life. I went to an all boys private school that was small compared to other high school, my graduating class was about 000. everyone knew that I moved out of my house and how I had trouble with my mom, and everyone feel sorry for me, and I’m sick of this whole drama thing, my life is so full of drama.  I went over by a few minutes I guess that’s all   ",152,1,734,15.29,11.72,95.78,66.35,22.62,13.76,10.49,1.09,0.0,1.36,0.82,8.86,3.81,16.76,9.95,5.04,10.22,0.41,10.35,12.81,7.08,1.77,3.81,1.5,0.14,8.86,0.14,0.54,1.23,5.86,2.72,3.13,0.27,0.68,0.82,21.53,3.13,0.54,1.09,3.0,2.86,0.27,6.68,4.22,1.23,0.41,0.27,0.41,1.63,0.0,1.5,0.14,0.0,16.35,2.59,6.81,6.95,1.77,0.54,0.95,0.27,0.41,0.0,0.0,0.14,0.27,0.82,12.67,6.4,3.68,0.0,0.0,0.0,0.0,0.14,0.0,2.45,0.0,0.0,734,00000,True,False
0,1,1,1,1,"It's only the second week of school, actually the first full week and I'm already so stressed out from studying. I'm not sure exactly how to study but I'm learning. I think maybe I should just make study guides so that's what I'm doing. Oh my gosh, I got to eat at the nicest restaurant last night, TrueLuck's. It was so good and I had such a good time. This past Saturday I wanted to go home so bad and was trying to get my boyfriend to come meet me in LOCNAME to eat. It didn't happen but in the long run I'm glad because I finally made some friends. I'm the kind of person who likes to have a lot of friends to hang out with and usually they are mostly guys. Though this doesn't much help my boyfriend's peace of mind. I'm not sure my roommate is that way but whatever. Anyway, well I met these really cool guys who I really like hanging out with. Sometimes I don't think PROPNAME likes them as much and it pisses me off because it makes me feel like she thinks I'm wrong to hang with guys because I have a boyfriend and so does she and well we're just really different. Well these guys ended up needing dates to a dinner for their fraternity so we said we'd go, I think PROPNAME only said yes because she had been drinking. Well I had so much fun and the guy I went with turned out to be really nice. It was great to finally go out and do something with people. I feel more at home now. Now to my boyfriend. We were best friends for 0 years before we even thought about dating. I love him so much and although I'm only 00 I pretty much believe he's the guy I'm suppose to be with when I get married. But my going away to college has been hard on both of us and in some ways harder on him. I understand that he's back home and doing the same things he's done for 0 years so he doesn't have as many things to keep his mind of missing me as I do but before we never argued and now he's always mad at me about something. He makes me feel awful when I go out and I know he doesn't mean to but it happens. He can't understand where I'm coming from. The guy I dated never cried every night and now he does and it gets depressing and makes me feel guilty. I want to have fun here without knowing that he's at home mad or crying. He's not the crying type of guy so I just don't understand. I love him more than anything and he should realize that, that is all that matters. No other guy here will ever take his place but that doesn't mean that I won't make other guy friends and go out with them. I don't even look at guys the same way because of Brent. My life here does not mean that what I feel in my heart is suddenly going to change. I just wish that he would go back to being the same Brent as before I left but I know that it is going to take time and I just need to realize this just as much as he needs to realize how bad he's making me feel. It's a compromise situation but I think everyone should have to go through this because if we're still together in the long run I know our relationship will be just that much stronger. I'm going home this weekend and I can't wait finally I can show Brent that my feelings for him are the same and I get to see my mom and sister. I have to go to my dad's and since he just moved out a few weeks ago it will be my first time to go and I'm not really looking forward to it. I want things to go back to normal with my family. The way it's suppose to be. If there is such a thing. The months before coming to college were so hard and stressful that at times I'm glad I'm here and away from all of it. At least I don't have to listen to the screaming and fighting. I wish my mom would try to fight for my dad and like lose weight or something. But she's being stupid. I miss my sister so much and my dog Tinker. My sister and I are so close we might as well be twins so I hate being away from her. ",2228,1,786,18.28,10.05,97.46,66.79,22.65,16.03,10.81,1.27,0.0,3.44,0.51,6.62,3.05,21.63,11.83,3.05,15.78,1.27,8.4,13.36,9.92,2.67,3.31,0.76,0.13,11.2,1.15,1.15,1.65,6.62,3.69,2.93,0.38,1.02,0.89,23.28,3.56,2.16,2.04,2.54,1.27,0.25,7.0,4.58,2.42,0.38,0.51,1.53,1.4,0.25,0.13,0.25,0.76,14.25,3.18,4.58,6.49,1.15,0.89,0.76,0.89,0.0,0.0,0.0,0.38,0.64,0.38,11.96,5.47,0.76,0.0,0.0,0.0,0.0,0.0,0.0,5.73,0.0,0.0,786,01111,True,False
0,0,1,1,0,"I'm really use to writing for long periods of time straight and not stop. I keep a little diary myself and write my thoughts and feelings down whenever they overwhelm me. I suppose it's some sort of stress release because I always feel better afterwards. Writing in my diary has allowed me to express my feelings and emotions onto paper. This way, it's easy for me to look at it and then maybe figure out how I am to deal with the emotions. Some things I write about are problems with my relationships with other people. One entry I wrote just recently was about a problem with this guy. There was just so much pressure on me from this guy that liked me that I couldn't really stand it anymore. He told me he liked me, and I suppose he expected me to just like him back. Don't get me wrong, he is a good friend of mine. Maybe that's why it was so hard. But anyways, I was able to express my contained feelings into my diary. It really did help a lot. When I first heard of this assignment on writing for 00 minutes straight without stopping I thought to myself ""wow, this will be fun"". My roommate, on the other hand groaned and said she would never be able to do something like that. She says there's just not that much to write about. I told her how she could just write bout her day or whatever. 00 minutes goes by pretty quickly if you think about it. It's already been about 0 minutes since I started. I'm typing kind of fast. I suppose it's the flow of the words. Since there's no really structure on this assignment, I can write without thinking too much. I had a pretty harsh day today. Didn't set my alarm clock, thus I woke up 00 minutes before my first class started. And my teacher Is a real stickler for this timing thing. She wants us in our seats and ready to go by the time class starts. That is usually what I would do, but today, I really couldn't do much about that. I hate walking into class late. There's only about 000 zillion people that look at you when you walk in. And you know what they're thinking, ""man, SHE's late"". I don't like that feeling. Well after the lecture (which I understood very well) I had to go back home because I hadn't brushed my teeth or anything yet. The whole way back I was thinking, ""man. it's too early in the year to be starting this"". But I got over it. Told my friends and laughed at it for a little bit. That's one of the reasons I love having my old friends here at LOCNAME. There's always someone there for you. It's like bringing a little bit of home with you. I live with one of my old friends from high school and she's an awesome roommate. Her boyfriend is also one of my good friends. And his roommate is the guy that I mentioned earlier. that likes me. Then I have many other old friends that are hear with me, and it just makes me feel more safe and comfortable. But I know I need to make other friends and I do. I like to just talk to people I don't know. You know that old rule ""never talk to strangers?"" Well, I don't follow that one too well. It's always nice to meet new people. They can always share new things with you that you couldn't get if you just stayed with your comfort zone. I like to venture out and make friends and do new things. People that don't like to do that, I feel, are too closed and unwilling to experiment and find out. It's scary being here. A brand new place with all these HUGE buildings towering above. Scattering around like ants looking for classes. In LOCNAME, we have big buildings and classes too, but, everything is so familiar there. I miss it, but I wouldn't want to be anywhere but here right now. I love the new atmosphere and environment UT provides. There are so many things to do. I'm enjoying it a lot. Maybe that's why I don't really feel a whole lot of stress with the new classes and deadlines and everything. I guess in happy here and that's what's most important to me. All the other things I can deal with as long as I'm feeling good. ",1470,1,762,12.1,15.75,95.54,63.78,23.49,14.44,10.37,0.39,1.44,1.97,0.26,9.06,3.28,16.54,10.37,3.02,11.68,0.52,8.79,12.6,6.82,2.49,2.62,1.71,0.0,11.42,0.0,1.57,1.31,6.96,5.25,1.44,0.79,0.13,0.26,22.7,3.02,2.1,1.97,3.54,1.44,0.66,5.77,4.07,2.49,0.39,0.52,1.57,0.52,0.26,0.0,0.26,0.0,15.35,1.05,5.38,9.06,1.84,0.79,0.52,0.66,0.0,0.0,0.0,0.13,0.52,0.52,17.19,8.14,2.76,0.0,0.0,0.13,0.0,0.0,1.05,4.86,0.26,0.0,760,00110,True,False
1,0,0,0,1,"I know that I have assignments to take care of but I do not want to complete them. I know it is incredibly important for me to perform these tasks. they can make or break my future. yet, I still never seem to be able to motivate myself. it is really frustrating sometimes. But that  is were the apathy sets in again and I will not take action. It seems like a cycle that I know at my house. My dad had behavior problems, to put them modestly, I could see how it would pain him, he did want to change, but it was as if he never followed through. I do not blame  him, I just see a pattern that is similar to mine. But at least I am working now. I still have German 000 to complete that is were I am most suffering. I need to review, and starting to catch up before I wind up failing. It would b e the realization of possibly my worst nightmare. Me being my only downfall, or rather me causing my own downfall. At some point I have to break this cycle but sometimes I don't think I will. But I must press on. If I don't turn it around, on my own now that I am in college, I am afraid I never will , and all the jokes about the weeding out process catching me will actually materialize. I have to start putting my foot down. Tonight was a good start. I told my suite mate who I am very good friends with that I could not go see a band play with him. instead I opted to stay home and do work. However, only now I am beginning to work on it. That is very disappointing . It seems as if it will be another late night, another example of destructive behavior. I will go home this weekend and perhaps seeing all my old friends and especially my parents will provide both some moments of relaxation and clarity for realizing the importance of my task at hand. It will be very nice to get away. The depravity of this city seems to be catching me. Or rather I am slowing down to let it get me. Waco is a much different society than LOCNAME. I cannot be lure d away. Then again that is a mistake for me to blame this city. Waco has all the same trappings, I just had a strict support system to keep me from falling . Now I can fall and It doesn't look that I will stop. I cannot think like that. But any rate, it will be nice to see the old friends and parents and perhaps be able to better take in my first 0 weeks of college and that way tell what all indeed I need to work ion to improve myself. I just know that this cannot go on or I will star0 to pay some very hefty consequences. My dad always told me before I left for UT that I would be greatly affected t by the people I surround myself with. I can see how this is partly true but I do not think they will control my pattern of thinking or my priorities. I will start breaking from their carelessness now and develop my own work habits. I will be in control of what it is I will do on any given evening instead of bowing to my lethargy and trying to relay on some mythical easy way out to appear. This is the time for me to start caring. I am not sure what else I can talk about. I have run the gamut with those previous thoughts and to talk of them more would just seem to be beating a dead horse. My mind is almost weary from thinking about the subject and I need an escape. Perhaps it is the midnight hour approaching that is getting to me. I don't believe that I have  much longer to continue writing on this assignment. Two very large priorities for the even0ihng that I still have to take care of is my German, which I have already stressed the importance of, but also washing clothes because tomorrow I return to work and I need better clothing than what I am wearing, or have been wearing for the past two days. It may seem late, but if I am outrunning that new leaf, I am going to have to start somewhere, and if not now, when. My mind is growing blank and I believe that I should rest before going on to the next assignment so as not to be staring for thoughts on the next topic. ",552,1,789,16.1,15.08,91.38,65.27,20.53,13.81,12.42,0.0,0.0,0.63,0.76,6.72,3.42,19.26,12.55,1.65,12.93,2.79,5.45,13.43,6.34,2.28,3.42,0.63,0.0,4.18,0.51,0.51,0.25,4.82,2.92,1.9,0.25,0.51,0.38,18.63,2.79,1.39,2.92,4.44,1.77,0.51,3.3,4.56,1.27,1.01,0.0,0.25,0.63,0.38,0.25,0.0,0.0,14.83,2.41,4.31,7.35,1.9,2.66,0.76,0.38,0.13,0.0,0.13,0.0,0.0,0.25,9.51,6.21,2.79,0.0,0.0,0.0,0.0,0.0,0.0,0.51,0.0,0.0,792,10001,True,False
