cAGR,cCON,cEXT,cOPN,cNEU,text,Filename,Segment,WC,WPS,Sixltr,Dic,funct,pronoun,ppron,i,we,you,shehe,they,ipron,article,verb,auxverb,past,present,future,adverb,preps,conj,negate,quant,number,swear,social,family,friend,humans,affect,posemo,negemo,anx,anger,sad,cogmech,insight,cause,discrep,tentat,certain,inhib,incl,excl,percept,see,hear,feel,bio,body,health,sexual,ingest,relativ,motion,space,time,work,achieve,leisure,home,money,relig,death,assent,nonfl,filler,AllPunc,Period,Comma,Colon,SemiC,QMark,Exclam,Dash,Quote,Apostro,Parenth,OtherP,essay_length,personality_type,has_story,has_lexicon
0,0,1,1,1,"     Hello looks like a journal entry. Frustrating blank page as usual, not nearly as much  pressure as a true journal might be. No, true journals (at least the ones I know) come complete  with the most irrational, egotistical, subjective criticisms at all. Here, I might simply start to list  adjectives. Think I will. Chair, run, cake, spoon, sparrow, harly, make, spy, insult, laughter,  organization, economy, ----- complete crap!!! Ha! Adjectives are fun. What to make of this  phenomenal opportunity?  Don't be shy, be compliant. Or just spew forth venom, anecdotes,  general life lessons. Inclination says talk about ""me"". Here's what that is. Or so we'll try. Music, menus, frustration. Solitary, isolated, friendship social butterfly. Making waves the size  of anthills, feeling pretty depressed about it. The color of the water is green. Count the levels  of meaning there. Anaphor. Hyperbole. Homonyms. LOCNAME LOCNAME. LOCNAME LOCNAME. The  LOCNAME LOCNAME of my Ass. Could I say here that I want to ______ the president?  Protect Identity. The blank might have been filled with ""make love"" or ""marry"" or ""help through important  issues"". Certainly not ""castrate. ""  What else?  Looking forward to making A's lots of A's, because  after all purpose belongs to those classes in which one might be rewarded for hard work and  ass kissing. Discombobulated this page may be, but organization's overrated. I know a quote:  one advantage of being disorganized is that one is constantly making new discoveries. ""  That  one's right above Dad's desk at the office. Why do I experience comfort in an environment less  than rational? or organized?  Possibly the same reason I love psychoactive mindbenders (by this,  of course, I refer to puzzles and games like scrabble!) Because true beauty in life exposes itself  not in the routine, as religious dogma might promise, but at an Indian buffet at which one can  stand before a plethora of unfamiliar treasures, waiting for the unfamiliar perspective of a  Western mind for validation. what else?  I think this weekend I'm going to stimulate myself with  something organic - or possibly inorganic - and clean up the house. Make normal people  sense of the place so that when PROPNAME and Dad show up tomorrow they don't swallow their  tongues. Music makes everything voluptuous, adds another layer to experiences so that they  find their way to memory lane more frequently and effectively. Takeover from an armchair. Natural delicacies. TV numbs, music accentuates, pleasure reading enriches, highest level math  and science is God. School puts the kind of pressure on people that creates PROPNAME PROPNAME. LOCNAME is  anything but a good school, just like college immidiately following high school is anything but a  good idea. Just going doesn't plant seeds of positivity or success. I was the fool, caught in the  wave of college matriculation, and still to this day I feel I need four more years. Just like that  fucking idiot GW PROPNAME. Right now, and not because I endorse the use of any of the following  terms, I'm going to type into this mind drain a slew of derrogatory or defamatory terms that I  rarely use but that for some reason are to come out when I open the floodgates. It's because I  wanted to call PROPNAME a faggot, or a fucking idiot, or a fucking shithead hyppocrite, but some  mechanism that pisses on creativity and ultimate truth caught me in the act and slapped my red  hand before any other utterance could follow. Well, here, you fuck, stop this!!!!  Oh, I was going  to go into some racial slurs, but that's just so stupid. How about cracker-ass whitebread honky  guerro americano puto!  that would be perfect for me. Still, something about WASPy racial slurs  isn't nearly as intimidating as ""nigger"" or ""spic"" or daggerhead, or whatever. This world exists  as a cesspool of religious dogma, hate, and a need to evolve. It's going to suck till that evolution  takes place, but God Damn it, I'll wallow in the shit till I die and I'll like it. Couldn't qualify, for  that reason, as the typical ""good people"" one might imagine a large percentage of those floating  around LOCNAME for some god or cause might hope. That's what makes music --- done. Thanks  for the toilet! ",2380,1,699,11.27,23.75,82.26,49.5,11.59,5.01,4.15,0.14,0.14,0.0,0.57,6.58,6.01,12.02,7.15,1.0,7.73,1.86,4.58,12.45,7.87,1.43,3.15,0.86,2.0,3.86,0.29,0.14,0.43,8.87,4.86,4.01,0.57,2.72,0.29,22.32,2.86,3.86,1.43,6.01,1.72,0.43,3.15,4.72,3.0,1.0,0.86,0.57,3.0,1.29,0.43,1.43,0.29,10.59,2.58,5.01,3.15,2.72,2.43,1.43,0.29,0.14,1.29,0.14,0.29,0.14,0.57,26.32,7.15,8.15,0.14,0.0,0.86,1.57,1.57,2.43,3.0,0.57,0.86,706,00111,True,False
0,1,0,1,1,"I cannot believe that my mother called to tell me about the pregnancy test, it's none of her fucking business. Besides she doesn't have to shout it out I wonder if my roommate hear, now she is playing that damn music again. red hot chili peppers. I should really be reading my book for lit right now instead of doing this, I wonder if my watch is going to break again, broke twice today. I just bought that nice new one and I've hardly worn it. Don't want to mess it up with scratches and all. I still can't believe that about mom. She can be such a god-damn BITCH. I think she is calling to see how I am, and instead she just screams at me about the damn clinic. At least I avoided her questions pretty well, but she can still draw her own conclusions. I want to talk to PROPNAME. it's been a while since we've had a good talk. All she tells me about now is her boyfriend PROPNAME. That relationship is trouble. She is not her own person anymore; she lives for him now. She doesn't even stay at home, is over at his place all day, lies to her mom, and uses ME as an excuse. Damn. I haven't talked to PROPNAME in a while. I hope he is thinking about me. I need to call him and also send him his present. Hope he likes the card I picked out. it suits both him and me, so I thought it was perfect. I hope my cell phone doesn't crap out on me again it's so old and worthless. My arm is itching. I wonder if I should wear sunscreen tomorrow since I have been burning a little. trade off between cancerous skin damage and nice-looking tan skin God, I could use some coffee especially since I'll be up for a while reading all that stuff I hope punctuation doesn't count in this I don't think it does anyway. It's probably going to tell me how negative and depressed I am. I am not really, though I am pissed at mom and I hate that I am at UT Even the name conveys a sense of sheer stupidity. I worked my ass off for LOCNAME and here I am in this hell-hole. I hate these damn community bathrooms, and I hate that the laundry room is so far away. God the last time I wrote this crazily was when I wrote that suicide note junior year of high school I hate that PROPNAME I hope he burns in hell for making my life fall to shit like that. If not for him, I might be in LOCNAME right now instead, but grade aside, I can't forgive him for all the emotional damage he did When I read that note later, it made me cry to see how far into depression I had fallen. And mom didn't even help me after I cried out for help. well how ironic that I'm in psychology now. The psychology major needed a shrink herself. hahha. I hope tomorrow is not very sunny but I don    t want rain either. too much sun hurts my eyes. I hope I don't oversleep since I'll be up so late tonight. I can't believe someone cut and pasted a dvd manual in this one time; it's such an easy assignment. God my hips are huge. I have lost weight since I came here, all this walking around. But I want to lose a little more. I wish I had PROPNAME's body. She is so gorgeous! Even more so than PROPNAME, and PROPNAME is one of the most beautiful people I know. But I am not all bad myself, I have my moments certainly. My jaw hurts again; I've been holding it too tensely because I am so stressed out I was perfectly fine until my mom called. well I'm almost finished, just a few minutes left. I wish I had a new phone. I hope that photo of my friends at banquet from last year doesn't fade; the light is right over it but I guess I have the negatives if I want another print. That reminds me, I haven't done photography in a long time. I left because I wasn't progressing, they didn't teach me anything, and I didn't like having to ward off PROPNAME. nice guy, but what a dork and oh so weird. I wonder if that was PROPNAME PROPNAME in front of me in math today. I told penner I'd contact him, but I don't know. what an easy quiz ",2049,1,776,13.61,12.24,93.3,62.24,22.94,17.53,13.27,0.13,0.0,3.99,0.13,5.41,3.61,17.91,11.21,4.25,11.86,0.64,7.6,10.57,6.96,3.48,2.96,0.52,1.68,9.41,0.77,0.39,0.39,9.15,3.74,5.41,0.64,2.45,1.55,16.75,2.19,1.93,3.48,3.74,1.29,0.26,3.48,3.22,2.32,1.03,0.52,0.64,2.58,1.68,0.64,0.39,0.26,13.27,1.03,6.31,5.8,1.93,0.77,1.42,0.52,0.39,0.9,0.13,0.13,0.39,0.26,15.59,7.09,3.35,0.0,0.52,0.0,0.13,0.39,0.0,4.12,0.0,0.0,772,01011,True,False
1,0,1,1,0,"Today. Had to turn the music down. Today I went to the KVRX meeting. I  will hopefully have my own radio show. I don’t know what I will talk about. I have considered in great depth and. Jeez this songs starts off quietly. cool beginning. should start louder. oh well can't all be perfect. My roommate is playing the same game . he plays that game too much and spends too much time with it. does he get homework?  I just don't know. This song is rather erotic. in a very deep and disturbing way. I can't decide whether I actually want to study medical technology or not. I love many things form chemistry to mycology to religious studies/. speaking  of which I had a very good time at my PSA meeting. PROPNAME student alliance. ahh. gotta love that screech the chairs let when you push them back. ahhhhh. well. oh yeah at the meeting I met several people. PROPNAME seems rather worried about one of the women. though he is bound and like wise I am unable  to speak ill of her. Well I am in charge of running our booth Monday. or is it Tuesday. That song is one again. his team (my roommate) I s winning. YEESH. Well I guess if he enjoys it. my typing is rather poor and this assignment is taking a long time. 00 minutes. been 0. . lalalalalalalal. Yes the meeting. I talked about shamanism. which apparently comes from a Siberian word. being that there are several hundred different shamanic following in this world. due to the vast number of tribes that speckle our world. PROPNAME PROPNAME has a very sexy voice. I would love to make love to this song,. Well. too much. info. /. Dtos are fun ellipses. that word too is fun. I think that perhaps I am slowly running out of things to say. . That song reminds me of my young age. riding in the car and talking to my  family. the streetlights were bright back then and things were happy. or where they. perhaps not,, I don't remember that well. My car was full of all of us and the  dog wasn't around. She isn't anymore either. epilepsy has taken her from this incarnation. I wonder what she is  doing now. Does she know that I miss her???? I  wish I could find out. Possibly clairvoyance. That is of course under the assumption that spirits are all equal. they are. I know. For I am. Yes I was and shall be. ever. My childhood bears a interesting mark of past fuzziness. I can't seem to recollect exact details like others. very brown. ,. fuzzy is the best word. The 00's really did suck. I wonder why that CD is still lying there on the answering machine. I love bright circling colors. they interest me. not in a psychotic manner but in a very hypnotic manner. they calm. I like to be calm and sedate/. Though activity on occasion is good. . . . PROPNAME is not a good color. neutral  yes but very passive. though passive is good. LOCNAME. there's a philosophy. They believe that by doing nothing they do everything. interesting. I am currently reading PROPNAME PROPNAME His hermetic order seems rather interesting though a bit on the abnormal and almost eccentric side. I remember reading stories about spiders. And milkmen in fields with roses. no daisies. yeah daisies. Looking down upon the daisies as they look up to me. I want to do a past life regression and find out who I was. I wonder if I have been anyone famous or popular. Wow I am saying some rather strange things. interesting. I didn't. . My head hurts. and my room is hot. I would like to stop this. I have 0 minutes left and nothing to say except for watching my fingers press the buttons is a rather enjoyable activity. they press slowly and heavy. sometimes fast and lithe. I mean light. yeah light. so I hope I am doing this right. I am putting my consciousness on record for others to read. I guess that's cool. It should be interesting though I have said very little. I wonder what other are saying. ahh the three minutes have passed and my typing ill now slow to a halt. ",166,1,717,6.4,16.6,89.82,58.02,18.41,12.55,9.07,0.42,0.14,1.67,1.26,5.86,4.6,16.88,11.3,2.37,11.99,1.12,7.39,9.48,5.02,2.23,2.65,1.12,0.28,8.37,0.14,0.28,0.28,7.39,6.28,1.12,0.28,0.28,0.28,15.48,3.49,0.28,2.51,3.91,0.98,0.42,3.35,3.21,4.88,1.12,2.23,1.26,2.09,0.28,0.7,0.98,0.14,12.41,1.53,5.44,5.44,1.95,0.7,2.79,0.7,0.28,0.42,0.0,1.39,0.84,0.28,20.08,16.46,0.56,0.0,0.0,0.7,0.0,0.0,0.0,1.67,0.28,0.42,725,10110,True,False
1,0,0,1,1,"Well, let's see, what am I thinking and feeling?  My thoughts are actually really scattered right now, but this is due tomorrow, so, here it goes. I guess what's really on my mind is this PROPNAMEy and this week. It's been really, really stressful. The only thing more stressful than having a lot of stress in you life is the people you love having a lot of stress in their lives too. The week did not start off well, as I lost a really cushy job, and it was just because I procrastanated and that made if even worse. Then, I got an interview, off campus 00 min of course, that was probably going to suck anyway, and I had all kinds of problems trying to print out resumes and work study verification forms because one computer had a printer and one had the internet and of course neither one would work with both, so I was frantically trying to get them to work and had no time for rest or lunch, didn't know where I was supposed to go and was freaking out. I could have cried. Right before I was about to walk out for my interview though, on chance I called back a lady that I had left a message for about a really cool job having to do with my major at an art museum on campus. It  was my dream job but I was sure it would already be gone. Just my luck though, I impressed the woman enough she hired me on the spot and I got the job!  It was really cool, but the stress leading up to it sucked. So things got better after that but today things were just shit. One of my friends is having all kinds of family problems because her father was being a selfish jerk. My other best friend's grandmother died and needless to say he was very upset. I cooked dinner for them though, but there is still so much drama around me and I hate drama. I guess I can't complain though, my job is great. I love working with art. The lady I'm working with takes time to tell me about everything. There were just a lot of jobs cut though and I feel really bad for her because I know she has a lot of stress because a lot of her help just got fired. But my other co-worker is really funny and I like her a lot but I'm really sad that she might be going away soon to LOCNAME, D. C. Everyone  else seems really awesome though and it's really laid back and flexible. Let's see what else. Oh yeah, of course boy troubles. Boys suck, that's all there is to it. Sometimes, I wish they would all just die. Or at least those that suck. Not my friend da PROPNAME though. I love him. He e-mailed me another of his famous funny e-mails and it always makes me feel better. :)  Also people who criticize you for stuff that's none of their business. Know what I really need?  A break from all people. I just want to be alone. I want to jump on a plane and go some place thousands of miles away with a different culture and everything. I want to go to a dig in LOCNAME and get away from everything. I hate feeling I owe something to other's feelings. I guess I'm just tired. The minute you get caught up in others lives you invite so much drama and pain into your life. I guess I'm just tired of that. It would just be great to start all over again, but I know that I can't regret the past and that I learn from everything I do. I have to keep reminding myself that my life is really not that bad after all, I mean I have awesome classes, great oppurtunities, a man that really does love me, and friends who really do mean the best even if I do want to choke them or run away from them sometime. In the end, I guess it's worth it because I know how lonely and boring life would be with out all of them there. It's just what you have to put up with. I only wish judgement from those you love was not so harsh or deep reaching. Well, I'm about out of time (thankfully my shoulder is hurting) so this is my great rant, but I'm done now and writing all out really does make you feel better. :) ",1711,1,765,16.28,9.8,94.9,66.01,20.26,13.2,9.28,0.26,1.18,1.44,1.05,7.06,4.18,18.69,10.33,4.71,11.76,0.78,9.67,12.42,8.5,1.31,4.05,0.78,0.65,9.15,0.39,0.52,1.18,9.15,4.31,4.84,1.05,1.31,0.92,22.35,2.22,1.44,2.35,3.53,1.96,0.13,5.49,6.41,1.57,0.26,0.13,1.18,2.35,0.26,1.05,0.65,0.39,10.59,1.7,4.97,3.92,3.53,1.96,1.18,0.13,0.39,0.0,0.26,0.78,0.39,0.0,13.99,5.75,4.05,0.26,0.0,0.26,0.13,0.39,0.0,2.61,0.52,0.0,764,10011,True,False
0,1,1,0,1,"I really don't know the first thing to say in this paper. I know I was confused about what to do, but there is really no confusion to it. is there? I don't know why I am talking to the computer like it is really going to talk back to me. Well, what am I thinking. I first want to know why it is so darn cold in all of these buildings, like I am about to freeze now in the computer lab at LOCNAME, and my roommate is talking to me about her boyfriend coming to see her today. Hell, I hate men right about now, because my man and I broke up a few weeks ago, before I came to school because he can't handle being in a serious relationship, that just happens to be long distance. I just don't know what the problem is. I mean if I am capable of being faithful, which has come pretty hard for me in the past, then I can be in a committed relationship. God, I need to get these nails off of my fingers because I keep messing up and having to backspace all the time. I think I'll get them soaked off tomorrow, after I get my navel pierced. I must seem like a really superficial person considering some of the things that are running through my mind. My fingers are starting to hurt because I am having to work extra hard because I have on these freaking nails. I just saw the number one in the tower on the computer screen that this boy just showed me. He looked so young, and he was actually kind of cute, but not tall enough. I know I just said that I hate men, but that was a lie. I can't live without them. Especially the tall ones that play basketball or run track or something. God, I want a man! I wonder how I would sound of I started talking all philosophical and stuff. I am not the type to go into deep analytical thinking, and I bet you are say, then why are you in my class. I think that the you are cool. I mean Prof. PROPNAME seems to be cool, but anyway. I am so bored right now, I have to braid this dude's hair, and I kind of don't want to, but he's going to pay me and I need some money, soon, and there is some back to school thing in the business atrium tonight. I guess I will go for a little while, not too long because I have a class at 000 in the morning, and it just happens to be calculus, and my damn teacher can't even speak english all the way. Why would the math department of all departments have teachers that students can't understand? I don't freaking get it. It's one of the hardest subjects at this school, and someone that is a first year teacher and can't speak english is teaching the class. WHY? Are the powers that be trying to torture me? Well, whatever happens, I will stay prayed up and depend on the lord to help me through this tough class. I just thought about something, I am not going to be able to go home this weekend because my parents are going to LOCNAME for Labor Day to visit my auntie PROPNAME, and my Uncle PROPNAME. I wonder how Precious is doing. I hope she still isn't messing with that idiot PROPNAME, like I think she still is. when will she ever learn, men that pray on you, and want all of your money, and wreck your car are not good boyfriend material. I mean, I know that I have had some trouble in the past dealing with idiot men, but I learned my lesson. I want to find me someone to act right and help me along the way when I need it. Is that too much to ask for? Gee, I can go on and on about men, and the experience s that I have had with them, but that is old and I am in a new place, and have to meet new men, and make new friends and most of all make awesome grades so that I can be on the dean's list like I want to be, and make the cheerleading team this year is going to prove to be a great one, and I hope that the lord blesses me do do well in all that I do this year and my years to come. I know that I am capable of doing it all, but I just want to survive. This city is filled with opportunity, and it's all mine for the taking!  ",1391,1,793,19.34,12.61,95.33,63.81,20.43,13.62,11.35,0.0,0.76,1.13,0.38,6.81,4.92,18.92,11.22,1.51,14.63,0.88,5.93,12.36,7.19,2.27,2.52,0.88,0.38,6.81,0.38,0.5,1.26,4.79,2.4,2.4,0.25,0.88,0.25,20.05,3.66,2.27,2.14,3.28,1.77,0.13,4.67,3.91,2.65,0.5,0.76,1.26,0.5,0.38,0.13,0.0,0.0,13.24,2.4,5.04,5.42,3.78,1.64,0.63,0.25,0.63,1.13,0.0,0.38,0.38,0.63,13.37,4.41,5.93,0.0,0.0,0.63,0.25,0.0,0.0,2.14,0.0,0.0,795,01101,True,False
