cAGR,cCON,cEXT,cOPN,cNEU,text,Filename,Segment,WC,WPS,Sixltr,Dic,funct,pronoun,ppron,i,we,you,shehe,they,ipron,article,verb,auxverb,past,present,future,adverb,preps,conj,negate,quant,number,swear,social,family,friend,humans,affect,posemo,negemo,anx,anger,sad,cogmech,insight,cause,discrep,tentat,certain,inhib,incl,excl,percept,see,hear,feel,bio,body,health,sexual,ingest,relativ,motion,space,time,work,achieve,leisure,home,money,relig,death,assent,nonfl,filler,AllPunc,Period,Comma,Colon,SemiC,QMark,Exclam,Dash,Quote,Apostro,Parenth,OtherP,essay_length,personality_type,has_story,has_lexicon
0,1,1,1,0,"I got back yesterdayform LOCNAME , from my cousins wedding. it was agreat. we parited so hard I think I have to fo into detox for a while. it sucks because now I'm back at school and its time to study and get the grades. mami and pai keep telling me I  have to do good but as if I ddnt lknow that already. they think that I'm some kind of schmuck who doent know what he is doing. i  mean I'm nineteen years old , I'm in college they would at least trust me a little b\it to do good. its actuallty funny the fact that they worry more about the way I'm keeping my room than my grades. i like her. PROPNAME she's cool and I'm enjoying myself while I'm with her. but shes going through a ha\rd tiome right now , I shouldnt butt in . its not my place. let things pass and then go in for the kill. I want to party tonight. this sucks. i ve to go to the frat tonight and then study. tomorrow, I have to do assighnment two of the class. i like how these things are and how they only take twenty minutes. never in my life would I have thought it be like this. i ts funny their is a vaccuum goiing on outside but since I don't necessarily have to concentrate it doesn't bother me . I just keep writing and writing. I more worried a boput the spelling and grammer than what I actually writing about. i hope my brother is doing good. he got so trashed onfriday and saturday and hten at the weeding sunday I thinnk que estamos en las mismas. i miss home. but not hta much . yesterday I was htinking that I now consider Austin my home becasue my dad offered me to go home after the wedding and miss a couple of days from school butI had no desire to. i have to call PROPNAME and PROPNAME tonight before Jer. leaves to umass. wow, I still can't believe that I was in LOCNAME for one year. and now I'm at LOCNAME the one University that I really wanted to go  to and I'm siotting in PROPNAME's rooom after the year we spent togther and I'm actually having a good time. i love it here. Its quite in these dorms not like mine. the girls are coming around. i'm meeting more and more people everyday and today we going to party . probably not but that would have been hella cool. I can't believe I'm at texas. call jesse. for PROPNAME PROPNAME. My mouyth is dry I wish PROPNAME would just get me a drink. I wish I could telepathically tell him that I wanted some water. it seems so stupid whyat I'm writing about. but the Prof knows what he's doing or he's making look like idiot. Ha , five hundred plus people being taken for schmucks that s pretty funny except for me cause I know whats up[. i think so. What now. I feel like I'm at a blank but I just keep thinking about stufff. weird. I didnt know thaqt so many things pass horugh my mind at this type of speed I can hardly tp fast enough, my hands are getting tired. ouch that hurts. Shut up out hteir I'm working here. Ha Ha I jsut thought that abnd it didnt come out of my mouth. I like who I am this is fumn. i wonder wha0t the future has ins tored for me I hope I'm successfule. i will be successful;. what else the timwe is ticking and I just killing it. i should be a rapper. Or a country singer that be cool the first Puerto Rican counrty singer in the world . ladies and Gentelemn . mr. PROPNAME PROPNAME. ANd the crowd goes wild. what the time 0:00 I have four more minutes but I have the uregeto keep on wrtiung PROPNAME always said wrting was good for the mind. i feel like a burden of whats going on in my life has been lifeted. i'm going to start doing this every day just to make me uhjnstress. what a schmuck. perfectionist. hes cleaning his room that s all he aever does. even in LOCNAME. its not bad but obsessive yes. i think extremes are bad. 0 minutes and conting. breath PROPNAME PROPNAME . G-df I'm exausted. I fell  like I'm not breathing fast enough to go with writing I'm kinda light headed . its as if I was relly tired  ",645,1,759,10.12,13.31,86.03,57.71,21.74,15.28,12.65,0.4,0.0,1.58,0.66,6.46,4.48,18.18,11.46,2.5,13.18,0.92,4.35,10.28,6.59,1.98,2.11,1.58,0.4,6.19,0.4,0.0,0.53,6.19,3.95,2.24,0.4,0.92,0.4,16.86,2.64,0.92,2.24,2.11,0.92,0.66,4.35,3.43,1.58,0.13,0.13,1.19,1.71,0.66,0.66,0.26,0.26,13.18,2.24,4.74,6.46,2.24,0.66,0.4,0.92,0.13,0.0,0.26,1.05,0.0,0.79,15.28,9.88,0.92,0.13,0.13,0.0,0.0,0.13,0.0,3.69,0.0,0.4,768,01110,True,False
0,0,0,1,1,"Entering college is a whole new experience that is new to me. One that is unique in its own right. An experience that begins a new transition from the home to a life ORGNAME individuality and freedom. Being only three hours away from home, it didn't seem like I was breaking away on my own, but in actuality this is only the start of creating a new life for myself. After high school, everyone left there own way in seeking out a future for themselves. One friend would move to LOCNAME LOCNAME and another would move to LOCNAME. The once click of friends that you grew up is now a long distance relationship creating friends coast to coast. Although ORGNAME is a new change for me, it is one that is welcoming because it begins a new chapter in your life and basically gives you a clean slate to work on. From this day forward, I am able to become whatever my heart desires and whatever happened in the past I can put behind as memories. The challenge is a great one however with its competitive nature. Back in high school, I would hear stories of friends failing out of LOCNAME due to its luring temptation of the atmosphere of clubs and alcohol. Everyone seemed to be lured into the trap and go deranged when they got on their own. I would hear stories of friends messing up in school and having to return home. These stories although depressing helped me however in establishing the goal that I would not be like the rest, but an individual. That's what ORGNAME is basically is, just a group of individuals all with the same goal, a goal of succeeding which is sad that some take it lightly and begin to ruin their lives. Its like its own community at LOCNAME. All students relatively the same age trying to create a future for themselves. I sometimes wonder if I have what it takes to succeed at ORGNAME. My mind is still in doubt seeing the enormous campus each day as I walk to class. But all I can ask for is for my best and that is good enough for me. Even though ORGNAME is a different city than my home town LOCNAME, I still feel like I haven't left LOCNAME in a way. With all my friends attending this ORGNAME it just seems like LOCNAME all over again which is one of the reasons I was considering going out of State. It seems great to have a large number of your friends close to you, but in a way I have a desire to start totally fresh. Throughout campus, I would see students from my school walking up and down the street and sometimes wish that a whole new atmosphere was around me so that I can begin a life that is not attached to my old one. The University of ORGNAME does however let you become any kind of person you desire with a new start even though it is kind of mixed in with the old. As for home, I sometimes wonder if my parents are doing well without me. With their constant calls and visits, it seems like they lost a part of themselves when they had to let go of me. So along with the stress that comes along with being a student at a ORGNAME, my stress also comes with the worry of how things are back home. Seeing my mom cry, tore my heart apart with the goodbye that completed my transition to ORGNAME. I notice how people don't show how lucky they are that they have an opportunity like going to ORGNAME but instead take it lightly as if its nothing when in fact thousands of dollars are being invested in you in hopes that you create a successful future for yourself. College is a whole new experience that allows you tremendous independence. It is my job that I spend my time wisely and take advantage of the situation in creating something out of myself. I see some of my friends just wasting their lives away on drugs and partying. I would like to do something for them, but their destiny is their own fate of what they and make out of it. All I can offer them is my support. Although fear did strike me before I entered UT, it now has turned into an excitement of a whole new world. ",1122,1,745,20.69,17.85,92.48,62.82,17.45,10.34,6.71,0.0,1.34,0.0,2.28,7.11,6.85,14.09,8.86,1.74,10.2,0.94,4.7,16.11,6.17,0.94,3.76,1.21,0.0,7.92,0.27,1.07,0.67,6.17,4.56,1.61,0.67,0.0,0.81,15.84,1.88,1.88,2.01,3.09,1.21,0.0,4.97,2.28,1.48,0.67,0.27,0.13,1.21,0.27,0.94,0.0,0.13,16.51,2.42,7.25,6.85,3.09,2.82,0.4,0.94,0.4,0.0,0.0,0.0,0.13,0.81,7.79,4.83,2.42,0.0,0.0,0.0,0.0,0.0,0.0,0.54,0.0,0.0,747,00011,True,False
0,0,1,0,1,"This is the second paper I have written like this because somehow the other one disappeared right when I was trying to push the   Finish   button. It seems like my life is always going the wrong way or I have bad luck such as this for most of the time. I did just get through working out with my   Tae-bo   tape. After completing that I always feel 000% better about myself and problems. I guess you could say that is how I deal with all of my stress,even though my life is not all that bad. Whenever someone thinks their life is terrible I always think about those children that you see on television that are starving or sick. I don't know why but I whenever I see a homeless person on the street I immediately feel sorry for them but then I start to think about why they don't have a job or are not in a shelter. My mind goes back and fourth like that a lot. LOCNAME has a lot of homeless and I am so not used to that atmosphere, that is partly why I don't like living here. And because my boyfriend wants me to come back closer to where he lives which is LOCNAME, where I live as well. I chose LOCNAME and UT because a lot of people told me that I should not go here, including my boyfriend. That just made me want to come even more though, dispite the fact that I could tell at orientation that I was not going to like it. My boyfriend is very important to me though because I have dated him for 0 years and we have a really special relationship. I can tell just by looking at him exactly what he is thinking about. I have never really had that with anyone before and he always tells me that he loves me. I find this kind of annoying because in my family I don't think that my mom or dad have ever told me those three words. My grandmother has but I used to just say it not even thinking about what it really meant. I guess that is why whenever he tells me that repeatably it starts to get on my nerves. Hopefully I don't have love issues or something of that nature because don't get me wrong I truly know that my parents love me but they just never told me. I have had a good life so I really don't need to complain about small things. I am in a very difficult spot in my life, college is a lot harder than most people say. I mean I expected the classes to be difficult and challenging but not the living on your own part. I was always so ready to get away from my house and away from the town that I lived in. Now I am not so sure about this because I don't really like Austin. I believe that I would have been better at a smaller school but I never really thought about those issues when I was selecting a college. I was too busy talking to or seeing my boyfriend or worrying about stupid high school bull that goes on everyday. I should have not cared where my best friend went to school, even though she was supposed to come here with me and then suddenly changed her mind without telling me. I am not resentful or anything but I feel that it is partly her fault, no it's not it is all my fault. I am the one who chose my future and now I want to change those plans. I guess I should be greatful that my roommate is not some freak with earrings and tattoos all over her body. I always think that things can always get worse and if you're lucky they sometimes get better. At least I did not get stuck in the same room as my suite mates because they are kind of snobbish. For instance, if I see them outside of our dorm then I have to say hi and if I don't they pretend they don't know me. I don't understand why people are like that but who am I to make a judgement, for all I know they are really sincere and nice people. I talk about people way too much but if you do it for so long it just comes natural and you can't stop. My room is actually really comfortable right now, usually it is either way hot or real cold.         ",1527,1,766,21.28,11.88,95.56,66.58,23.89,16.32,12.53,0.26,0.78,1.44,1.31,7.57,3.26,18.02,10.05,3.39,13.58,0.52,8.75,10.05,8.75,3.92,2.87,0.91,0.0,9.66,0.65,0.91,0.91,5.61,3.0,2.61,0.26,0.52,0.0,23.76,2.74,2.61,2.22,5.09,2.74,0.13,3.52,6.79,1.96,0.65,0.52,0.78,1.83,0.26,1.04,0.39,0.13,12.27,1.83,4.44,5.61,1.57,1.17,0.39,0.78,0.0,0.0,0.0,0.0,0.13,0.91,8.22,4.7,1.44,0.0,0.0,0.0,0.0,0.13,0.0,1.83,0.0,0.13,766,00101,True,False
0,0,0,1,0,"    The first thing that coems to mind is how much I hate the stupid popups that are getting in the way of my writing and slowing down my laptop. The man that invented those should be shot. Now I'm starting to remember what was said in class about this assignment. It seemed like a really dumb assignment to do, but I prefer writing for only twenty minutes versus actually drafting up some essay and spending hours writing and rewriting and losing sleep over it. There really isn't much too this, which should've been fairly obvious to everyone in class. Why is it that no matter where you go there's always someone really really stupid that'll ask the same question that someone else asked only a few seconds before them. If I was a teacher that would really annoy me. It would be fun to put those dog shock collars on those types of people, you know the ones that everyone growns inwardly (and sometimes outwardly) at as soon as they open their mouth because nothing good will come out. I actually really do like the psych class. The assignment is aggravating because I know that odds are no one will ever read this and I'm doing it just for my own amusement. I know if I cheat and just copy and paste something or bang on the keyboards for 00 mins, then I'll feel bad about it. Oh well, 00 minutes isn't that big of a deal anyways. I'm killing time until my boyfriend gets done with his project so I can talk to him again. My mind is trying to go into thinking about my bf, but I'm not going to let that happen. I know that most people have a hard time making a ""long distance"" relationship work when the distance really isn't that far. All the girls I've met left a bf in LOCNAME or LOCNAME. I wish that's how far away he was because I could go and see him on the weekends. Actually, if he was anywhere in the LOCNAME, then it would really help, but I knew what I was getting into when we decided to stay together. No more boyfriend talk. I start looking around the room to think of something else, but the first thing that catches my eye is my roommate's vase of big yellow flowers that her bf just sent her. That's really not helping. I keep thinking about something in Spanish, but I'm guesssing whoever might read this (I doubt anyone ever will) won't know Spanish so I guess I should write it in english. La ausencia para el amor es como el viento para el fuego: extingue lo pequeno  y the fuerza a lo grande. That would translate to, Absence for love is like wind for fire: it extinguishes the small and gives strength to the large. Sounds much better in Spanish though. Now I'm starting to remember that anytime Spanish comes up, everyone asks how I know it and when I tell them I lived in LOCNAME LOCNAME they always ask if that's where I'm from. That has to be THE single most annoying question. I've been asked so many times, too many times. And no matter how many times I explain I'm from LOCNAME, and my parents are 000% American, people still assume that my family must be Mexican. It's like asking an oriental person if their family is originally from LOCNAME. It's just stupid. I don't look hispanic at all. Everyone assumes too much. When I say I lived in South American, they all assume LOCNAME. And when I say no, then they think I must have lived in a hut in the middle of the jungle. But its not only the Americans. Now I'm remembering all the dumb questions I got when I moved to LOCNAME. When I said I'm from LOCNAME, they all said no you're not, you're not wearing any boots and a gallon hat. Or they'd ask where my horse was, or what happend if my horse got sick and how would I get to school if that happened. Plus I got all the dumb PROPNAME jokes. PROPNAME used to call me Bushwa instead of LOCNAME, my last name. Pretty creative though. I'm glad he's happy at ORGNAME ",2355,1,717,16.67,16.04,88.56,60.81,19.94,11.72,8.51,0.14,0.56,1.12,1.39,8.23,4.88,17.43,10.6,3.91,10.18,2.37,8.51,9.76,8.37,2.37,3.63,0.98,0.42,10.88,0.42,0.84,0.84,4.46,2.23,2.23,0.14,1.67,0.14,21.06,3.49,1.81,2.79,5.02,1.81,0.14,3.49,5.44,1.95,0.7,0.84,0.42,0.7,0.42,0.14,0.14,0.0,14.09,1.39,6.56,6.0,2.23,1.12,0.98,0.56,0.14,0.0,0.14,0.14,0.14,0.42,14.78,5.86,3.07,0.28,0.0,0.0,0.0,0.0,0.28,4.6,0.56,0.14,717,00010,True,False
1,1,1,0,1,"Right now I am feeling very annoyed. I have to do my first lab write up and I am so confused. I wish I could get it all done now so that this holiday weekend I wouldn't have to worry about it. I am going home this weekend for the first time in a month or so. Even though I am a junior I have felt like such a freshmen this past week becuause I just transfered here. I don't think that's a bad thing , to feel like a freshmen, but it's really weird. I can't wait to go home. I got my parents and my brother a ORGNAME gift form the Co Op I can't believe that PROPNAME is getting married this weekend. I think the wedding will be a lot of fun. I love the dress that I get to wear since I am a bridesmaid. I really though that if anyone was going to get married first it would be me. I am the one that hads the most stable realationship. i really hope taht their marriage works out. They haven't always gotten along really well. In fact when I first met her a year ago he was galavanting around town with some 0 other gulklirls. She is just that type of girl though to go for the ""jerk"" kind of guy. i really think that this was more of a pressure thing that they are doing this because since he went into the ORGNAME ORGNAME and then found out that he was going to LOCNAME I think he was scared to do it alone and he knew that he has always had her buy a string. I n all the time that I have known them they have never been really compasionate to each other and whats worse is that I used to hate him because of how he treated her and all the things I heard about him. well I wish the best for the two of them. I hope I don't forget anything for the wedding this weekend. I am still so nervous about this semester since I am in a new school. I think that I will be okay though because I know how to magage my time and use it wisely. It's dunny because there is always something to do. Tonight I made dinner for my boyfriend, my roomate and 0 of his roomates. That makes me feel good when I can do other things for people like that. We had spagetti salad french bread and I baked some cookies. I am feeling a t peace with myself right now becuase I now that I am doing all I can do to be the best. Not because I made dinner. But because I have gotten so much accomplished today int he way of school work and all the errands I had to run. It is so nice to sit here in this quiet apartment by myself and write for 00 min. I feel bad because I din't work out today. I have been doing really well though by going at least 0-0 times a week and running 0-0 miles a day and then doing weights. For some reason though I feel really fat. When I think about what I ate at dinner I want to gag. Oh my gosh I just thought about my Gov class and how boring it is. It was funny though becuase he was telling us that one student said that it was so boring it made him want to gounge his eyes out with a spoon. That;s hilarious becuase thats kind of how I felt today. The cool thing is that he published his lecture notes and I think they will help out a lot. He is also going to give out the test that he used in the summer for us to study. I don't think I have had a prof with worse organizationl skills. I was trying to take notes and it was so hard becuase he jumps around so much. you got to feel sorry for the guy though. At least he knows that he is not the most interesting guy. He also told us thata student told him that he talked like PROPNAME PROPNAME. Very monotone. That was funny. The more and more I think about it it is true. Geez I can't believe I still have to do that long lab report that is going to take me forever and my TA has still not emailed me beck. At least for the first one she is going to grade them and then return them so we can correct it. That's really cool of her   ",987,1,783,15.66,10.09,92.59,65.9,24.14,15.58,9.83,0.64,0.13,3.83,1.15,8.56,5.11,18.9,11.24,5.24,11.88,0.64,8.17,10.09,7.66,1.53,3.07,2.04,0.0,9.58,0.51,0.38,0.64,4.85,2.68,2.17,0.64,0.38,0.13,18.26,3.45,2.81,1.28,2.17,1.66,0.26,4.6,2.55,2.17,0.13,0.38,1.66,1.53,0.38,0.13,0.13,1.15,11.11,1.66,3.19,6.0,2.94,1.79,1.15,0.77,0.13,0.0,0.0,0.51,0.38,0.51,8.94,6.26,0.38,0.0,0.13,0.0,0.0,0.26,0.26,1.66,0.0,0.0,783,11101,True,False
